{
  "$ref": "#/definitions/albums",
  "definitions": {
    "albums": {
      "type": "object",
      "properties": {
        "title": {
          "type": "string"
        },
        "slug": {
          "type": "string"
        },
        "description": {
          "type": "string"
        },
        "coverPublicId": {
          "type": "string"
        },
        "items": {
          "type": "array",
          "items": {
            "type": "object",
            "properties": {
              "publicId": {
                "type": "string"
              },
              "width": {
                "type": "number"
              },
              "height": {
                "type": "number"
              },
              "caption": {
                "type": "string"
              }
            },
            "required": [
              "publicId"
            ],
            "additionalProperties": false
          }
        },
        "$schema": {
          "type": "string"
        }
      },
      "required": [
        "title",
        "slug",
        "items"
      ],
      "additionalProperties": false
    }
  },
  "$schema": "http://json-schema.org/draft-07/schema#"
}